{"category":"spiritual-discourses","categoryName":"Spiritual Discourses","subcategory":"karthika-puranam","subcategoryName":"Karthika Puranam","videos":[{"id":"9_iPn7CO9vQ","t":"Kaartheeka puraanam chapter 6","p":"2024-11-07","th":"https://i.ytimg.com/vi/9_iPn7CO9vQ/mqdefault.jpg","l":"en"},{"id":"vuq_uvozYjY","t":"KAARTHEEKAPURAANAM chapter 5","p":"2024-11-06","th":"https://i.ytimg.com/vi/vuq_uvozYjY/mqdefault.jpg","l":"en"},{"id":"A4CtRO3oA_M","t":"kaartheeka puraanam chapter 2","p":"2024-11-03","th":"https://i.ytimg.com/vi/A4CtRO3oA_M/mqdefault.jpg","l":"en"},{"id":"ws5_msBNzZg","t":"KAARTHEEKAPURAANAM chapter 1","p":"2024-11-02","th":"https://i.ytimg.com/vi/ws5_msBNzZg/mqdefault.jpg","l":"en"},{"id":"4Cniy9ZTp5Q","t":"Kaartheekapuraanam chapter 20","p":"2023-12-03","th":"https://i.ytimg.com/vi/4Cniy9ZTp5Q/mqdefault.jpg","l":"en"},{"id":"r_Gy6qPp8pY","t":"Kaartheeka puraanam chapter 19","p":"2023-12-02","th":"https://i.ytimg.com/vi/r_Gy6qPp8pY/mqdefault.jpg","l":"en"},{"id":"eDgiLBWoM5Y","t":"Kaartheeka puraanam chapter 18","p":"2023-12-01","th":"https://i.ytimg.com/vi/eDgiLBWoM5Y/mqdefault.jpg","l":"en"},{"id":"qtNp9DfR300","t":"kaartheeka puraanam chapter 17","p":"2023-11-30","th":"https://i.ytimg.com/vi/qtNp9DfR300/mqdefault.jpg","l":"en"},{"id":"3A5KhVjAsGw","t":"Kaartheeka puraanam chapter 16","p":"2023-11-29","th":"https://i.ytimg.com/vi/3A5KhVjAsGw/mqdefault.jpg","l":"en"},{"id":"Sxcty4bnzgo","t":"Kaartheeka puraanam chapter 15","p":"2023-11-28","th":"https://i.ytimg.com/vi/Sxcty4bnzgo/mqdefault.jpg","l":"en"},{"id":"bvLHniBYrXI","t":"Kaartheeka puraanam chapter 14","p":"2023-11-27","th":"https://i.ytimg.com/vi/bvLHniBYrXI/mqdefault.jpg","l":"en"},{"id":"7y7j2t8BaHg","t":"Kaartheeka puraanam chapter 13","p":"2023-11-26","th":"https://i.ytimg.com/vi/7y7j2t8BaHg/mqdefault.jpg","l":"en"},{"id":"nUtN8ty0rUY","t":"Kaartheeka puraanam chapter 12","p":"2023-11-25","th":"https://i.ytimg.com/vi/nUtN8ty0rUY/mqdefault.jpg","l":"en"},{"id":"ZIUjIhrcN1Q","t":"Kaartheeka puraanam chapter 11","p":"2023-11-24","th":"https://i.ytimg.com/vi/ZIUjIhrcN1Q/mqdefault.jpg","l":"en"},{"id":"huWTWYtpIRQ","t":"Kaartheeka puraanam chapter 10","p":"2023-11-23","th":"https://i.ytimg.com/vi/huWTWYtpIRQ/mqdefault.jpg","l":"en"},{"id":"rrS7cXKG5Vo","t":"Kaartheeka puraanam chapter 9","p":"2023-11-22","th":"https://i.ytimg.com/vi/rrS7cXKG5Vo/mqdefault.jpg","l":"en"},{"id":"wc2EzMEf3no","t":"Kaartheeka puraanam chapter 8","p":"2023-11-21","th":"https://i.ytimg.com/vi/wc2EzMEf3no/mqdefault.jpg","l":"en"},{"id":"2xlYr2ZOBx0","t":"Kaartheeka puraanam chapter 6&7","p":"2023-11-20","th":"https://i.ytimg.com/vi/2xlYr2ZOBx0/mqdefault.jpg","l":"en"},{"id":"Z78Kozkd4n4","t":"kaartheeka puraanam chapter 4","p":"2023-11-17","th":"https://i.ytimg.com/vi/Z78Kozkd4n4/mqdefault.jpg","l":"en"},{"id":"Z2vhu83FlDQ","t":"Kaartheeka puraanam chapter 3","p":"2023-11-16","th":"https://i.ytimg.com/vi/Z2vhu83FlDQ/mqdefault.jpg","l":"en"},{"id":"MykiTmi45MQ","t":"Kaartheeka puraanam chapter 2,","p":"2023-11-15","th":"https://i.ytimg.com/vi/MykiTmi45MQ/mqdefault.jpg","l":"en"},{"id":"SkyEfyNOpL0","t":"kaartheeka puraanam chapter 1","p":"2023-11-14","th":"https://i.ytimg.com/vi/SkyEfyNOpL0/mqdefault.jpg","l":"en"},{"id":"iJTG0qcANgk","t":"Karthikapuranam chapter 30","p":"2019-11-26","th":"https://i.ytimg.com/vi/iJTG0qcANgk/mqdefault.jpg","l":"en"},{"id":"zYwyz2QZ1Zo","t":"Karthikapuranam chapter 29","p":"2019-11-25","th":"https://i.ytimg.com/vi/zYwyz2QZ1Zo/mqdefault.jpg","l":"en"},{"id":"Uleyimek57o","t":"Karthikapuranam chapter 28","p":"2019-11-24","th":"https://i.ytimg.com/vi/Uleyimek57o/mqdefault.jpg","l":"en"},{"id":"SsowNfOU4QA","t":"Karthikapuranam chapter 27 pravachanam on 23/11/2019","p":"2019-11-23","th":"https://i.ytimg.com/vi/SsowNfOU4QA/mqdefault.jpg","l":"en"},{"id":"I89_VtrhIUg","t":"Karthikapuranam yadhatadham chapter 26 ,pravachanam by sivanandasastry in 22/11/2019","p":"2019-11-22","th":"https://i.ytimg.com/vi/I89_VtrhIUg/mqdefault.jpg","l":"en"},{"id":"LsGCGdjVzlI","t":"Karthikapuranam chapter 25 pravachanam on 21/11/2019","p":"2019-11-21","th":"https://i.ytimg.com/vi/LsGCGdjVzlI/mqdefault.jpg","l":"en"},{"id":"V3jXwj3q09Q","t":"Karthikapuranam chapter 24 pravachanam on 20/11/2019","p":"2019-11-20","th":"https://i.ytimg.com/vi/V3jXwj3q09Q/mqdefault.jpg","l":"en"},{"id":"ATtSNkr273U","t":"Karthikapuranam chapter 23 pravachanam on 19/11/2019","p":"2019-11-19","th":"https://i.ytimg.com/vi/ATtSNkr273U/mqdefault.jpg","l":"en"},{"id":"Tor6XTGaZpg","t":"Karthikapuranam chapter 22 pravachanam on 18/11/2019","p":"2019-11-18","th":"https://i.ytimg.com/vi/Tor6XTGaZpg/mqdefault.jpg","l":"en"},{"id":"LMMfdO9CauU","t":"Karthikapuranam chapter 20 pravachanam on 17/11/2019","p":"2019-11-17","th":"https://i.ytimg.com/vi/LMMfdO9CauU/mqdefault.jpg","l":"en"},{"id":"2KdEHfTN-no","t":"Karthikapuranam chapter 19 pravachanam on 16/11/2019","p":"2019-11-16","th":"https://i.ytimg.com/vi/2KdEHfTN-no/mqdefault.jpg","l":"en"},{"id":"3CmxPtGcfS8","t":"Karthikapuranam chapter 18 pravachanam on 15/11/2019","p":"2019-11-15","th":"https://i.ytimg.com/vi/3CmxPtGcfS8/mqdefault.jpg","l":"en"},{"id":"cwG346x3yAc","t":"Karthikapuranam chapter 16","p":"2019-11-13","th":"https://i.ytimg.com/vi/cwG346x3yAc/mqdefault.jpg","l":"en"},{"id":"pi5kIgC0GP8","t":"Karthikapuranam chapter 15 pravachanam on 12/11/2019","p":"2019-11-12","th":"https://i.ytimg.com/vi/pi5kIgC0GP8/mqdefault.jpg","l":"en"},{"id":"hSjp0zY00BI","t":"Karthikapuranam chapter13","p":"2019-11-10","th":"https://i.ytimg.com/vi/hSjp0zY00BI/mqdefault.jpg","l":"en"},{"id":"lfPDQfTfMBs","t":"Karthikapuranam chapter 11","p":"2019-11-10","th":"https://i.ytimg.com/vi/lfPDQfTfMBs/mqdefault.jpg","l":"en"},{"id":"hZ53OqriWx8","t":"Karthikapuranam chapter 10","p":"2019-11-10","th":"https://i.ytimg.com/vi/hZ53OqriWx8/mqdefault.jpg","l":"en"},{"id":"aZzwqbIBk_Q","t":"Karthikapuranam chapter 9 pravachanam on 6/11/2019","p":"2019-11-06","th":"https://i.ytimg.com/vi/aZzwqbIBk_Q/mqdefault.jpg","l":"en"},{"id":"6yWFSGxPKPQ","t":"Karthikapuranam chapter 8 pravachanam on 5/11/2019","p":"2019-11-05","th":"https://i.ytimg.com/vi/6yWFSGxPKPQ/mqdefault.jpg","l":"en"},{"id":"1uuoTF-UGsg","t":"Karthikapuranam chapter 7 pravachanam on 4/11/2019","p":"2019-11-04","th":"https://i.ytimg.com/vi/1uuoTF-UGsg/mqdefault.jpg","l":"en"},{"id":"wfRn1_eyC9g","t":"Karthikapuranam chapter 6 pravachanam on 3/11/2019","p":"2019-11-03","th":"https://i.ytimg.com/vi/wfRn1_eyC9g/mqdefault.jpg","l":"en"},{"id":"6h8fe0KSzMw","t":"Karthikapuranam chapter 5 pravachanam on 2/11/2019","p":"2019-11-02","th":"https://i.ytimg.com/vi/6h8fe0KSzMw/mqdefault.jpg","l":"en"},{"id":"fllSEtaBEBU","t":"Karthikapuranam chapter 4 pravachanam on 1/11/2019","p":"2019-11-01","th":"https://i.ytimg.com/vi/fllSEtaBEBU/mqdefault.jpg","l":"en"},{"id":"gnmhaGd_Gz8","t":"Karthikapuranam chapter 3 pravachanam on 31/10/2019","p":"2019-10-31","th":"https://i.ytimg.com/vi/gnmhaGd_Gz8/mqdefault.jpg","l":"en"},{"id":"VgdZt774x5U","t":"Karthikapuranam chapter 2 pravachanam on 30/10/2019","p":"2019-10-30","th":"https://i.ytimg.com/vi/VgdZt774x5U/mqdefault.jpg","l":"en"},{"id":"5OzOX7tNkp4","t":"Karthikapuranam pravachanam on 29/10/2019","p":"2019-10-29","th":"https://i.ytimg.com/vi/5OzOX7tNkp4/mqdefault.jpg","l":"en"},{"id":"qTAkmpHCATc","t":"Karthikapuranam chapter 30","p":"2018-12-07","th":"https://i.ytimg.com/vi/qTAkmpHCATc/mqdefault.jpg","l":"en"},{"id":"loTPanJQMgE","t":"Karthikapuranam chapter 29","p":"2018-12-06","th":"https://i.ytimg.com/vi/loTPanJQMgE/mqdefault.jpg","l":"en"},{"id":"sGjhseVjxPc","t":"Karthikapuranam chapter 28","p":"2018-12-05","th":"https://i.ytimg.com/vi/sGjhseVjxPc/mqdefault.jpg","l":"en"},{"id":"KOD0KqEIXuo","t":"Karthikapuranam chapter 27","p":"2018-12-04","th":"https://i.ytimg.com/vi/KOD0KqEIXuo/mqdefault.jpg","l":"en"},{"id":"pj0j91hLTAA","t":"Karthikapuranam. chapter 26","p":"2018-12-03","th":"https://i.ytimg.com/vi/pj0j91hLTAA/mqdefault.jpg","l":"en"},{"id":"id7B9y-zpJg","t":"Karthikapuranam chapter 25","p":"2018-12-02","th":"https://i.ytimg.com/vi/id7B9y-zpJg/mqdefault.jpg","l":"en"},{"id":"r156TQ2yGUM","t":"Karthikapuranam chapter 24","p":"2018-12-01","th":"https://i.ytimg.com/vi/r156TQ2yGUM/mqdefault.jpg","l":"en"},{"id":"QHCGdaHhyRw","t":"Karthikapuranam chapter 12","p":"2018-11-19","th":"https://i.ytimg.com/vi/QHCGdaHhyRw/mqdefault.jpg","l":"en"},{"id":"6dlD3Qh1KF0","t":"Karthikapuranam chapter 11","p":"2018-11-18","th":"https://i.ytimg.com/vi/6dlD3Qh1KF0/mqdefault.jpg","l":"en"},{"id":"gD0BnTz744I","t":"Karthikapuranam chapter 10","p":"2018-11-17","th":"https://i.ytimg.com/vi/gD0BnTz744I/mqdefault.jpg","l":"en"},{"id":"1a8OUn-gG8U","t":"Karthikapuranam chapter 9","p":"2018-11-16","th":"https://i.ytimg.com/vi/1a8OUn-gG8U/mqdefault.jpg","l":"en"},{"id":"_HDx3LeuMs8","t":"Karthikapuranam chapter 8","p":"2018-11-15","th":"https://i.ytimg.com/vi/_HDx3LeuMs8/mqdefault.jpg","l":"en"},{"id":"x7GS-d2huUU","t":"Karthikapuranam chapter 7","p":"2018-11-14","th":"https://i.ytimg.com/vi/x7GS-d2huUU/mqdefault.jpg","l":"en"},{"id":"cBU9K3OLxTg","t":"Karthikapuranam chapter 6","p":"2018-11-13","th":"https://i.ytimg.com/vi/cBU9K3OLxTg/mqdefault.jpg","l":"en"},{"id":"C-NJrES62gw","t":"Karthikapuranam chapter 5","p":"2018-11-12","th":"https://i.ytimg.com/vi/C-NJrES62gw/mqdefault.jpg","l":"en"},{"id":"w_Z3n0g53Zc","t":"Karthikapuranam chapter 4","p":"2018-11-11","th":"https://i.ytimg.com/vi/w_Z3n0g53Zc/mqdefault.jpg","l":"en"},{"id":"TlygSW0v9ao","t":"Karthikapuranam chapter 3","p":"2018-11-10","th":"https://i.ytimg.com/vi/TlygSW0v9ao/mqdefault.jpg","l":"en"},{"id":"tytrsOAeudA","t":"Karthikapuranam chapter 2","p":"2018-11-09","th":"https://i.ytimg.com/vi/tytrsOAeudA/mqdefault.jpg","l":"en"},{"id":"OAaqKjrQ9YU","t":"karthikapuranam chapter 1","p":"2018-11-08","th":"https://i.ytimg.com/vi/OAaqKjrQ9YU/mqdefault.jpg","l":"en"},{"id":"_rfk42mOib8","t":"Karthikapuranam","p":"2017-11-18","th":"https://i.ytimg.com/vi/_rfk42mOib8/mqdefault.jpg","l":"en"},{"id":"jLLB65zI7a0","t":"Karthikapuranam","p":"2017-11-17","th":"https://i.ytimg.com/vi/jLLB65zI7a0/mqdefault.jpg","l":"en"},{"id":"UTzDnbsGPMI","t":"Karthikapuranam","p":"2017-11-16","th":"https://i.ytimg.com/vi/UTzDnbsGPMI/mqdefault.jpg","l":"en"},{"id":"ayp2BoCrlx0","t":"Karthikapuranam","p":"2017-11-15","th":"https://i.ytimg.com/vi/ayp2BoCrlx0/mqdefault.jpg","l":"en"},{"id":"_T5YLe9Tlpc","t":"Karthikapuranam","p":"2017-11-14","th":"https://i.ytimg.com/vi/_T5YLe9Tlpc/mqdefault.jpg","l":"en"},{"id":"MHs0L1j0rBA","t":"Karthikapuranam","p":"2017-11-13","th":"https://i.ytimg.com/vi/MHs0L1j0rBA/mqdefault.jpg","l":"en"},{"id":"MDb3zcltHh0","t":"Karthikapuranam","p":"2017-11-10","th":"https://i.ytimg.com/vi/MDb3zcltHh0/mqdefault.jpg","l":"en"},{"id":"gCMemZtCqdg","t":"Karthikapuranam","p":"2017-11-09","th":"https://i.ytimg.com/vi/gCMemZtCqdg/mqdefault.jpg","l":"en"},{"id":"IQ9S5Sx5akI","t":"Karthikapuranam","p":"2017-11-08","th":"https://i.ytimg.com/vi/IQ9S5Sx5akI/mqdefault.jpg","l":"en"},{"id":"GXQQWKc_GFc","t":"Karthikapuranam","p":"2017-11-07","th":"https://i.ytimg.com/vi/GXQQWKc_GFc/mqdefault.jpg","l":"en"},{"id":"fZIZOU7onvM","t":"Karthikapuranam","p":"2017-11-06","th":"https://i.ytimg.com/vi/fZIZOU7onvM/mqdefault.jpg","l":"en"},{"id":"PiFS4dqD_ts","t":"Karthikapuranam","p":"2017-11-05","th":"https://i.ytimg.com/vi/PiFS4dqD_ts/mqdefault.jpg","l":"en"},{"id":"Gplc0aCS0ww","t":"Karthikapuranam","p":"2017-11-04","th":"https://i.ytimg.com/vi/Gplc0aCS0ww/mqdefault.jpg","l":"en"},{"id":"vR4DQHHBSAY","t":"Karthikapuranam","p":"2017-11-03","th":"https://i.ytimg.com/vi/vR4DQHHBSAY/mqdefault.jpg","l":"en"},{"id":"fXvTsvR8SIw","t":"Karthikapuranam","p":"2017-11-02","th":"https://i.ytimg.com/vi/fXvTsvR8SIw/mqdefault.jpg","l":"en"},{"id":"h0JaThvcKR4","t":"Karthikapuranam","p":"2017-11-01","th":"https://i.ytimg.com/vi/h0JaThvcKR4/mqdefault.jpg","l":"en"},{"id":"9zWxtXJ8qR8","t":"Karthikapuranam","p":"2017-10-31","th":"https://i.ytimg.com/vi/9zWxtXJ8qR8/mqdefault.jpg","l":"en"},{"id":"y17ylHnraso","t":"Karthikapuranam","p":"2017-10-30","th":"https://i.ytimg.com/vi/y17ylHnraso/mqdefault.jpg","l":"en"},{"id":"03rH63qvuDw","t":"Karthikapuranam","p":"2017-10-29","th":"https://i.ytimg.com/vi/03rH63qvuDw/mqdefault.jpg","l":"en"},{"id":"hLxyFK0qIOk","t":"Karthikapuranam","p":"2017-10-28","th":"https://i.ytimg.com/vi/hLxyFK0qIOk/mqdefault.jpg","l":"en"},{"id":"8UxcC-lWqYQ","t":"Karthikapuranam","p":"2017-10-27","th":"https://i.ytimg.com/vi/8UxcC-lWqYQ/mqdefault.jpg","l":"en"},{"id":"winReuOtrC0","t":"Karthikapuranam","p":"2017-10-26","th":"https://i.ytimg.com/vi/winReuOtrC0/mqdefault.jpg","l":"en"},{"id":"YxX0OzNrYNQ","t":"Karthikapuranam","p":"2017-10-25","th":"https://i.ytimg.com/vi/YxX0OzNrYNQ/mqdefault.jpg","l":"en"},{"id":"SGGf_9v5QM8","t":"Karthikapuranam (video 2126/1058)","p":"2016-11-29","th":"https://i.ytimg.com/vi/SGGf_9v5QM8/mqdefault.jpg","l":"en"},{"id":"-pDGWiCabK0","t":"Karthikapuranam (video 2126/1054)","p":"2016-11-29","th":"https://i.ytimg.com/vi/-pDGWiCabK0/mqdefault.jpg","l":"en"},{"id":"-2ZhoqviXS0","t":"Karthikapuranam (via 1044/A)","p":"2016-11-29","th":"https://i.ytimg.com/vi/-2ZhoqviXS0/mqdefault.jpg","l":"en"},{"id":"Esr_vAhczes","t":"Karthikapuranam (video 2126/1044)","p":"2016-11-26","th":"https://i.ytimg.com/vi/Esr_vAhczes/mqdefault.jpg","l":"en"},{"id":"vl6_ct2C5NA","t":"Karthikapuranam (video 2126/1039)","p":"2016-11-25","th":"https://i.ytimg.com/vi/vl6_ct2C5NA/mqdefault.jpg","l":"en"},{"id":"Q_5eqmtZJhI","t":"Karthikapuranam (video 2126/1034)","p":"2016-11-24","th":"https://i.ytimg.com/vi/Q_5eqmtZJhI/mqdefault.jpg","l":"en"},{"id":"_eXDDpy4HhQ","t":"Karthikapuranam (video 2126/1029)","p":"2016-11-23","th":"https://i.ytimg.com/vi/_eXDDpy4HhQ/mqdefault.jpg","l":"en"},{"id":"yElCkbTDl6M","t":"Karthikapuranam (video 2126/1024)","p":"2016-11-22","th":"https://i.ytimg.com/vi/yElCkbTDl6M/mqdefault.jpg","l":"en"},{"id":"wtu-fHwx4mw","t":"Karthikapuranam  (video 2126/1019)","p":"2016-11-21","th":"https://i.ytimg.com/vi/wtu-fHwx4mw/mqdefault.jpg","l":"en"},{"id":"-6He6HtRXV8","t":"Karthikapuranam (video 2126/1014)","p":"2016-11-20","th":"https://i.ytimg.com/vi/-6He6HtRXV8/mqdefault.jpg","l":"en"},{"id":"-k8sROd2QEY","t":"Karthikapuranam (video 2126/1009)","p":"2016-11-19","th":"https://i.ytimg.com/vi/-k8sROd2QEY/mqdefault.jpg","l":"en"},{"id":"9yH4j5mA7NE","t":"Karthikapuranam  (video 2126/1004)","p":"2016-11-18","th":"https://i.ytimg.com/vi/9yH4j5mA7NE/mqdefault.jpg","l":"en"},{"id":"-gWkVYuZKRw","t":"Karthikapuranam (video 2126/998)","p":"2016-11-17","th":"https://i.ytimg.com/vi/-gWkVYuZKRw/mqdefault.jpg","l":"en"},{"id":"lBbkZuvR0hM","t":"Karthikapuranam (video 2126/973/1)","p":"2016-11-16","th":"https://i.ytimg.com/vi/lBbkZuvR0hM/mqdefault.jpg","l":"en"},{"id":"MLxVbkLSaro","t":"Karthikapuranam (video2126/992)","p":"2016-11-16","th":"https://i.ytimg.com/vi/MLxVbkLSaro/mqdefault.jpg","l":"en"},{"id":"Ve2BCcFiYlE","t":"Karthikapuranam (video 2126/986)","p":"2016-11-15","th":"https://i.ytimg.com/vi/Ve2BCcFiYlE/mqdefault.jpg","l":"en"},{"id":"QL1_WKP6yGk","t":"Karthikapuranam (video 2126/980)","p":"2016-11-14","th":"https://i.ytimg.com/vi/QL1_WKP6yGk/mqdefault.jpg","l":"en"},{"id":"1dCMqYN8aQ8","t":"Karthikapuranam (video 2126/973)","p":"2016-11-11","th":"https://i.ytimg.com/vi/1dCMqYN8aQ8/mqdefault.jpg","l":"en"},{"id":"PkDig6HeASk","t":"Karthikapuranam (video 2126/967)","p":"2016-11-10","th":"https://i.ytimg.com/vi/PkDig6HeASk/mqdefault.jpg","l":"en"},{"id":"abxvJwGlDG0","t":"Karthikapuranam (video 2126/961))","p":"2016-11-09","th":"https://i.ytimg.com/vi/abxvJwGlDG0/mqdefault.jpg","l":"en"},{"id":"vY8-o8Hn_j0","t":"Karthikapuranam (video 2126/955)","p":"2016-11-08","th":"https://i.ytimg.com/vi/vY8-o8Hn_j0/mqdefault.jpg","l":"en"},{"id":"bfoqEfSdDGY","t":"Karthikapuranam (video 2126/949)","p":"2016-11-07","th":"https://i.ytimg.com/vi/bfoqEfSdDGY/mqdefault.jpg","l":"en"},{"id":"DZX2egKB1-4","t":"Karthikapuranam (video 2126/943)","p":"2016-11-06","th":"https://i.ytimg.com/vi/DZX2egKB1-4/mqdefault.jpg","l":"en"},{"id":"kOF-kK9Z6fc","t":"Karthikapuranam (video 2126/937)","p":"2016-11-05","th":"https://i.ytimg.com/vi/kOF-kK9Z6fc/mqdefault.jpg","l":"en"},{"id":"eiDs3c9fCBg","t":"Karthikapuranam (video 2126/931)","p":"2016-11-04","th":"https://i.ytimg.com/vi/eiDs3c9fCBg/mqdefault.jpg","l":"en"},{"id":"YudSKIoBNqo","t":"Karthikapuranam (video 2126/913)","p":"2016-11-01","th":"https://i.ytimg.com/vi/YudSKIoBNqo/mqdefault.jpg","l":"en"},{"id":"al3uUsW8y-s","t":"Kartheekapuranam (video 2126/907/01)","p":"2016-10-31","th":"https://i.ytimg.com/vi/al3uUsW8y-s/mqdefault.jpg","l":"en"}]}