{"category":"spiritual-discourses","categoryName":"Spiritual Discourses","subcategory":"magha-puranam","subcategoryName":"Magha Puranam","videos":[{"id":"NWoeP0WlGCY","t":"Maghapuranam chapter 30","p":"2026-02-17","th":"https://i.ytimg.com/vi/NWoeP0WlGCY/mqdefault.jpg","l":"en"},{"id":"3LUymKi3Vnk","t":"Maghapuranam chapter 29","p":"2026-02-16","th":"https://i.ytimg.com/vi/3LUymKi3Vnk/mqdefault.jpg","l":"en"},{"id":"DCA5QwjhJu4","t":"Maghapuranam chapter 27","p":"2026-02-14","th":"https://i.ytimg.com/vi/DCA5QwjhJu4/mqdefault.jpg","l":"en"},{"id":"YytB85JE1tE","t":"Maghapuranam chapter 26","p":"2026-02-13","th":"https://i.ytimg.com/vi/YytB85JE1tE/mqdefault.jpg","l":"en"},{"id":"bZrtg4ANe4o","t":"Maghapuranam chapter 25","p":"2026-02-12","th":"https://i.ytimg.com/vi/bZrtg4ANe4o/mqdefault.jpg","l":"en"},{"id":"Cc9LsFPyqfk","t":"Maghapuranam chapter 24","p":"2026-02-11","th":"https://i.ytimg.com/vi/Cc9LsFPyqfk/mqdefault.jpg","l":"en"},{"id":"6nIC-hUF_KQ","t":"Maaghapuranam chapter 23","p":"2026-02-10","th":"https://i.ytimg.com/vi/6nIC-hUF_KQ/mqdefault.jpg","l":"en"},{"id":"WrmIBzzzEzI","t":"Maghapuranam chapter 22","p":"2026-02-09","th":"https://i.ytimg.com/vi/WrmIBzzzEzI/mqdefault.jpg","l":"en"},{"id":"gvCq3EmJfiU","t":"Maghapuranam chapter 21","p":"2026-02-08","th":"https://i.ytimg.com/vi/gvCq3EmJfiU/mqdefault.jpg","l":"en"},{"id":"2Zu29xgF-Q4","t":"Maghapuranam chapter 20","p":"2026-02-07","th":"https://i.ytimg.com/vi/2Zu29xgF-Q4/mqdefault.jpg","l":"en"},{"id":"D7TZMSDTcsA","t":"Maghapuranam chapter 19","p":"2026-02-06","th":"https://i.ytimg.com/vi/D7TZMSDTcsA/mqdefault.jpg","l":"en"},{"id":"EW1h6vv80Hk","t":"Maghapuranam chapter 18","p":"2026-02-05","th":"https://i.ytimg.com/vi/EW1h6vv80Hk/mqdefault.jpg","l":"en"},{"id":"l7kfxANTGE8","t":"Maaghapuraanam chapter 17","p":"2026-02-04","th":"https://i.ytimg.com/vi/l7kfxANTGE8/mqdefault.jpg","l":"en"},{"id":"kXP5Hyx20lc","t":"Maaghapuraanam chapter 16","p":"2026-02-03","th":"https://i.ytimg.com/vi/kXP5Hyx20lc/mqdefault.jpg","l":"en"},{"id":"BsTZ4cTX-W8","t":"Maaghapuraanam chapter 15","p":"2026-02-02","th":"https://i.ytimg.com/vi/BsTZ4cTX-W8/mqdefault.jpg","l":"en"},{"id":"9WmcXFx02_E","t":"Maaghapuraanam chapter 14","p":"2026-02-01","th":"https://i.ytimg.com/vi/9WmcXFx02_E/mqdefault.jpg","l":"en"},{"id":"49xGOi9_a0I","t":"Maaghapuraanam chapter 5, pravachanam 23/1/2026","p":"2026-01-23","th":"https://i.ytimg.com/vi/49xGOi9_a0I/mqdefault.jpg","l":"en"},{"id":"k4dRmiw0i1k","t":"Maaghapuraanam chapter 4","p":"2026-01-22","th":"https://i.ytimg.com/vi/k4dRmiw0i1k/mqdefault.jpg","l":"en"},{"id":"blyRw2bwBm4","t":"Maaghapuraanam chapter 3","p":"2026-01-21","th":"https://i.ytimg.com/vi/blyRw2bwBm4/mqdefault.jpg","l":"en"},{"id":"i2WJb0iHtq8","t":"Maaghapuraanam chapter 2","p":"2026-01-20","th":"https://i.ytimg.com/vi/i2WJb0iHtq8/mqdefault.jpg","l":"en"},{"id":"lIcSLjc-Ppc","t":"Maaghapuraanam chapter 1","p":"2026-01-19","th":"https://i.ytimg.com/vi/lIcSLjc-Ppc/mqdefault.jpg","l":"en"},{"id":"KG9gGkNTkQE","t":"maaghapuranam chapter 30","p":"2024-03-10","th":"https://i.ytimg.com/vi/KG9gGkNTkQE/mqdefault.jpg","l":"en"},{"id":"6kzgTElY8Iw","t":"maaghapuranam chapter 29","p":"2024-03-09","th":"https://i.ytimg.com/vi/6kzgTElY8Iw/mqdefault.jpg","l":"en"},{"id":"RL5TS52iBQ0","t":"maaghapuranam chapter 27","p":"2024-03-07","th":"https://i.ytimg.com/vi/RL5TS52iBQ0/mqdefault.jpg","l":"en"},{"id":"SYlnAPiWNNs","t":"maaghapuranam chapter 26","p":"2024-03-06","th":"https://i.ytimg.com/vi/SYlnAPiWNNs/mqdefault.jpg","l":"en"},{"id":"fXdgZLyoKlE","t":"maaghapuranam chapter 25","p":"2024-03-05","th":"https://i.ytimg.com/vi/fXdgZLyoKlE/mqdefault.jpg","l":"en"},{"id":"JzHihPzhIf8","t":"maaghapuranam chapter 24","p":"2024-03-04","th":"https://i.ytimg.com/vi/JzHihPzhIf8/mqdefault.jpg","l":"en"},{"id":"bic43DYLQis","t":"maaghapuranam chapter 23","p":"2024-03-03","th":"https://i.ytimg.com/vi/bic43DYLQis/mqdefault.jpg","l":"en"},{"id":"N_at6lJM5Nw","t":"maaghapuranam chapter 22","p":"2024-03-02","th":"https://i.ytimg.com/vi/N_at6lJM5Nw/mqdefault.jpg","l":"en"},{"id":"GGDfV5WioHU","t":"maaghapuranam chapter 21","p":"2024-03-01","th":"https://i.ytimg.com/vi/GGDfV5WioHU/mqdefault.jpg","l":"en"},{"id":"31twQnSg2s0","t":"maaghapuranam chapter 17","p":"2024-02-26","th":"https://i.ytimg.com/vi/31twQnSg2s0/mqdefault.jpg","l":"en"},{"id":"rXTl-LtZf_A","t":"maaghapuranam chapter 16","p":"2024-02-25","th":"https://i.ytimg.com/vi/rXTl-LtZf_A/mqdefault.jpg","l":"en"},{"id":"hj6GEwfE52I","t":"maaghapuranam chapter 15","p":"2024-02-24","th":"https://i.ytimg.com/vi/hj6GEwfE52I/mqdefault.jpg","l":"en"},{"id":"rw8PDBrVUmA","t":"maaghapuranam chapter 13","p":"2024-02-22","th":"https://i.ytimg.com/vi/rw8PDBrVUmA/mqdefault.jpg","l":"en"},{"id":"9Tom6jTfWXc","t":"maaghapuranam chapter 11","p":"2024-02-20","th":"https://i.ytimg.com/vi/9Tom6jTfWXc/mqdefault.jpg","l":"en"},{"id":"HbafkJjzqTo","t":"maaghapuranam chapter 10","p":"2024-02-19","th":"https://i.ytimg.com/vi/HbafkJjzqTo/mqdefault.jpg","l":"en"},{"id":"tJj-Mt8eD8Y","t":"maaghapuranam chapter 9","p":"2024-02-18","th":"https://i.ytimg.com/vi/tJj-Mt8eD8Y/mqdefault.jpg","l":"en"},{"id":"X3qIfd9fcfE","t":"maaghapuranam chapter 8","p":"2024-02-17","th":"https://i.ytimg.com/vi/X3qIfd9fcfE/mqdefault.jpg","l":"en"},{"id":"2NDmBgl_blE","t":"Maaghapuranam chapter 7","p":"2024-02-16","th":"https://i.ytimg.com/vi/2NDmBgl_blE/mqdefault.jpg","l":"en"},{"id":"pJudUCrQvlI","t":"maaghapuranam chapter 6","p":"2024-02-15","th":"https://i.ytimg.com/vi/pJudUCrQvlI/mqdefault.jpg","l":"en"},{"id":"h1kb7hbnyUc","t":"maaghapuranam chapter 5","p":"2024-02-14","th":"https://i.ytimg.com/vi/h1kb7hbnyUc/mqdefault.jpg","l":"en"},{"id":"gS5mROuPDMc","t":"maaghapuranam chapter 4","p":"2024-02-13","th":"https://i.ytimg.com/vi/gS5mROuPDMc/mqdefault.jpg","l":"en"},{"id":"2IISiiGN-T4","t":"maaghapuranam chapter 3","p":"2024-02-12","th":"https://i.ytimg.com/vi/2IISiiGN-T4/mqdefault.jpg","l":"en"},{"id":"m5Tw_46ee8U","t":"Maaghapuranam chapter 2","p":"2024-02-11","th":"https://i.ytimg.com/vi/m5Tw_46ee8U/mqdefault.jpg","l":"en"},{"id":"P4fKujE7NxI","t":"Maaghapuranam chapter 1","p":"2024-02-10","th":"https://i.ytimg.com/vi/P4fKujE7NxI/mqdefault.jpg","l":"en"},{"id":"jM64o8dEdKU","t":"MAAGHAPURAANAM chapter 29, pravachanam 19/2/2023","p":"2023-02-19","th":"https://i.ytimg.com/vi/jM64o8dEdKU/mqdefault.jpg","l":"en"},{"id":"fmasTIzc3Gs","t":"MAAGHAPURAANAM chapter 27, pravachanam 17/2/2023","p":"2023-02-17","th":"https://i.ytimg.com/vi/fmasTIzc3Gs/mqdefault.jpg","l":"en"},{"id":"FYKW5xEkW24","t":"MAAGHAPURAANAM chapter 26 pravachanam 16/2/2023","p":"2023-02-16","th":"https://i.ytimg.com/vi/FYKW5xEkW24/mqdefault.jpg","l":"en"},{"id":"gTLX68DJ1GA","t":"MAAGHAPURAANAM chapter 25, pravachanam 15/2/ 2023","p":"2023-02-15","th":"https://i.ytimg.com/vi/gTLX68DJ1GA/mqdefault.jpg","l":"en"},{"id":"nJOM9eOkIfw","t":"MAAGHAPURAANAM chapter 4","p":"2023-01-25","th":"https://i.ytimg.com/vi/nJOM9eOkIfw/mqdefault.jpg","l":"en"},{"id":"RXECCXaNjaA","t":"Maghapuranam yadhatadham Aaranyaparvam chapter 96","p":"2020-03-25","th":"https://i.ytimg.com/vi/RXECCXaNjaA/mqdefault.jpg","l":"en"},{"id":"dv3aLi62MLU","t":"Maghapuranam chapter 30","p":"2020-02-23","th":"https://i.ytimg.com/vi/dv3aLi62MLU/mqdefault.jpg","l":"en"},{"id":"tLa-13-G5Js","t":"Maghapuranam chapter 20","p":"2020-02-22","th":"https://i.ytimg.com/vi/tLa-13-G5Js/mqdefault.jpg","l":"en"},{"id":"6_-S89gOr1U","t":"Maghapuranam chapter 28","p":"2020-02-21","th":"https://i.ytimg.com/vi/6_-S89gOr1U/mqdefault.jpg","l":"en"},{"id":"D3ELe8HeOFY","t":"Maghapuranam chapter 26","p":"2020-02-19","th":"https://i.ytimg.com/vi/D3ELe8HeOFY/mqdefault.jpg","l":"en"},{"id":"rR0N6yXqhsE","t":"Maghapuranam chapter 25","p":"2020-02-18","th":"https://i.ytimg.com/vi/rR0N6yXqhsE/mqdefault.jpg","l":"en"},{"id":"g7fY2T_ZOnU","t":"Maghapuranam chapter 24","p":"2020-02-17","th":"https://i.ytimg.com/vi/g7fY2T_ZOnU/mqdefault.jpg","l":"en"},{"id":"C9FlycU4-e4","t":"Maghapuranam chapter 23","p":"2020-02-16","th":"https://i.ytimg.com/vi/C9FlycU4-e4/mqdefault.jpg","l":"en"},{"id":"dTpE4lotzTs","t":"Maghapuranam chapter 22","p":"2020-02-15","th":"https://i.ytimg.com/vi/dTpE4lotzTs/mqdefault.jpg","l":"en"},{"id":"I4sNOf6I5SI","t":"Maghapuranam chapter 21","p":"2020-02-14","th":"https://i.ytimg.com/vi/I4sNOf6I5SI/mqdefault.jpg","l":"en"},{"id":"F1QdnIv40_4","t":"Maghapuranam chapter 20","p":"2020-02-13","th":"https://i.ytimg.com/vi/F1QdnIv40_4/mqdefault.jpg","l":"en"},{"id":"xNQ1fy74DGk","t":"Maghapuranam chapter 19","p":"2020-02-12","th":"https://i.ytimg.com/vi/xNQ1fy74DGk/mqdefault.jpg","l":"en"},{"id":"wxg3UUBN25k","t":"Maghapuranam chapter ,18","p":"2020-02-11","th":"https://i.ytimg.com/vi/wxg3UUBN25k/mqdefault.jpg","l":"en"},{"id":"47hRmGGxZcM","t":"Maghapuranam chapter 17","p":"2020-02-10","th":"https://i.ytimg.com/vi/47hRmGGxZcM/mqdefault.jpg","l":"en"},{"id":"E_KWRKaeybE","t":"Maghapuranam chapter 11","p":"2020-02-04","th":"https://i.ytimg.com/vi/E_KWRKaeybE/mqdefault.jpg","l":"en"},{"id":"XTIKOt8XXd8","t":"Maghapuranam chapter 10","p":"2020-02-03","th":"https://i.ytimg.com/vi/XTIKOt8XXd8/mqdefault.jpg","l":"en"},{"id":"NWVoRYnJAPs","t":"Maghapuranam chapter 9","p":"2020-02-02","th":"https://i.ytimg.com/vi/NWVoRYnJAPs/mqdefault.jpg","l":"en"},{"id":"0kSS3Hylxv0","t":"Maghapuranam chapter 8","p":"2020-02-01","th":"https://i.ytimg.com/vi/0kSS3Hylxv0/mqdefault.jpg","l":"en"},{"id":"62bwM37Fv5c","t":"Maghapuranam chapter 7","p":"2020-01-31","th":"https://i.ytimg.com/vi/62bwM37Fv5c/mqdefault.jpg","l":"en"},{"id":"FwZCjK9CgUg","t":"Maghapuranam chapter 6","p":"2020-01-30","th":"https://i.ytimg.com/vi/FwZCjK9CgUg/mqdefault.jpg","l":"en"},{"id":"7k7NPHrCYHg","t":"Maghapuranam chapter 5","p":"2020-01-28","th":"https://i.ytimg.com/vi/7k7NPHrCYHg/mqdefault.jpg","l":"en"},{"id":"d0FUzpB2myM","t":"Maghapuranam chapter 3","p":"2020-01-27","th":"https://i.ytimg.com/vi/d0FUzpB2myM/mqdefault.jpg","l":"en"},{"id":"nKgAhrBtwjk","t":"Maghapuranam chapter 2","p":"2020-01-26","th":"https://i.ytimg.com/vi/nKgAhrBtwjk/mqdefault.jpg","l":"en"},{"id":"z2QRmg1muwU","t":"Maghapuranam chapter 1","p":"2020-01-25","th":"https://i.ytimg.com/vi/z2QRmg1muwU/mqdefault.jpg","l":"en"},{"id":"KFl2mhyP30k","t":"Maghapuranam yadhatadham sabhaparvam chapter 46","p":"2019-10-07","th":"https://i.ytimg.com/vi/KFl2mhyP30k/mqdefault.jpg","l":"en"},{"id":"Z4rapHj-WrI","t":"Maghapuranam chapter 30 pravachanam on 6/3/2019","p":"2019-03-06","th":"https://i.ytimg.com/vi/Z4rapHj-WrI/mqdefault.jpg","l":"en"},{"id":"NwJoulUa7CE","t":"Maghapuranam chapter 29","p":"2019-03-05","th":"https://i.ytimg.com/vi/NwJoulUa7CE/mqdefault.jpg","l":"en"},{"id":"4lxd6705gME","t":"Maghapuranam chapter 28 pravachanam on 4/3/2019","p":"2019-03-04","th":"https://i.ytimg.com/vi/4lxd6705gME/mqdefault.jpg","l":"en"},{"id":"iiuH_7ZheNY","t":"Maghapuranam  chapter 27 pravachanam on 3/3/2019","p":"2019-03-03","th":"https://i.ytimg.com/vi/iiuH_7ZheNY/mqdefault.jpg","l":"en"},{"id":"7NbkUIrRn3I","t":"Maghapuranam chapter 26","p":"2019-03-02","th":"https://i.ytimg.com/vi/7NbkUIrRn3I/mqdefault.jpg","l":"en"},{"id":"HN-cJAv2gK0","t":"Maghapuranam chapter 25 pravachanam on 1/3/2019","p":"2019-03-01","th":"https://i.ytimg.com/vi/HN-cJAv2gK0/mqdefault.jpg","l":"en"},{"id":"APkLqeOU5h8","t":"Maghapuranam chapter 24 pravachanam on 28/2/2019","p":"2019-02-28","th":"https://i.ytimg.com/vi/APkLqeOU5h8/mqdefault.jpg","l":"en"},{"id":"UtgY4E2B_Qg","t":"Maghapuranam chapter 23 pravachanam on 23/2/2019","p":"2019-02-27","th":"https://i.ytimg.com/vi/UtgY4E2B_Qg/mqdefault.jpg","l":"en"},{"id":"fQ1dECywgFQ","t":"Maghapuranam chapter 22","p":"2019-02-26","th":"https://i.ytimg.com/vi/fQ1dECywgFQ/mqdefault.jpg","l":"en"},{"id":"Iw8KW0EApWg","t":"Maghapuranam chapter 21","p":"2019-02-25","th":"https://i.ytimg.com/vi/Iw8KW0EApWg/mqdefault.jpg","l":"en"},{"id":"zVknn2PuZDg","t":"Maghapuranam chapter 25 pravachanam on 24/2/2019","p":"2019-02-24","th":"https://i.ytimg.com/vi/zVknn2PuZDg/mqdefault.jpg","l":"en"},{"id":"LQNrjZSUhtA","t":"Maghapuranam chapter 16 pravachanam on 20/2/2019","p":"2019-02-20","th":"https://i.ytimg.com/vi/LQNrjZSUhtA/mqdefault.jpg","l":"en"},{"id":"z3Ig_OXP2us","t":"Maghapuranam chapter 15 pravachanam on 19/2/2019","p":"2019-02-19","th":"https://i.ytimg.com/vi/z3Ig_OXP2us/mqdefault.jpg","l":"en"},{"id":"hWjGSqoQZLk","t":"Maghapuranam chapter 14 pravachanam on 18/2/2019","p":"2019-02-18","th":"https://i.ytimg.com/vi/hWjGSqoQZLk/mqdefault.jpg","l":"en"},{"id":"R08pJIaVsjk","t":"Maghapuranam chapter 13 pravachanam on 17/2/2019","p":"2019-02-17","th":"https://i.ytimg.com/vi/R08pJIaVsjk/mqdefault.jpg","l":"en"},{"id":"h7tMKVZ7qvc","t":"Maghapuranam chapter 12 pravachanam on 16/2/2019","p":"2019-02-16","th":"https://i.ytimg.com/vi/h7tMKVZ7qvc/mqdefault.jpg","l":"en"},{"id":"FFnqXG_vWxk","t":"Maghapuranam chapter 11 pravachanam on 15/2/2019","p":"2019-02-15","th":"https://i.ytimg.com/vi/FFnqXG_vWxk/mqdefault.jpg","l":"en"},{"id":"l0lO-I1LMFc","t":"Maghapuranam chapter 10 pravachanam on 14/2/2019","p":"2019-02-14","th":"https://i.ytimg.com/vi/l0lO-I1LMFc/mqdefault.jpg","l":"en"},{"id":"_C_CuqBM-hQ","t":"Maghapuranam chapter 9 pravachanam on 13/2/2019","p":"2019-02-13","th":"https://i.ytimg.com/vi/_C_CuqBM-hQ/mqdefault.jpg","l":"en"},{"id":"pV_7-8VFEOc","t":"Maghapuranam chapter 8 pravachanam on 12/2/2019","p":"2019-02-12","th":"https://i.ytimg.com/vi/pV_7-8VFEOc/mqdefault.jpg","l":"en"},{"id":"2BLRLYBJMQ4","t":"Maghapuranam chapter 6 pravachanam on 10/2/2010","p":"2019-02-10","th":"https://i.ytimg.com/vi/2BLRLYBJMQ4/mqdefault.jpg","l":"en"},{"id":"IZbuuoyokwM","t":"Maghapuranam chapter 5 pravachanam on 9/2/2019","p":"2019-02-09","th":"https://i.ytimg.com/vi/IZbuuoyokwM/mqdefault.jpg","l":"en"},{"id":"rXXc-wlLofM","t":"Maghapuranam chapter 4 pravachanam on 8/2/2019","p":"2019-02-08","th":"https://i.ytimg.com/vi/rXXc-wlLofM/mqdefault.jpg","l":"en"},{"id":"4-Sq8J3dGJw","t":"Maghapuranam chapter 3 pravachanam on 7/2/2019","p":"2019-02-07","th":"https://i.ytimg.com/vi/4-Sq8J3dGJw/mqdefault.jpg","l":"en"},{"id":"gqz8rUpHfF4","t":"Maghapuranam pravachanam on 6/2/2019","p":"2019-02-06","th":"https://i.ytimg.com/vi/gqz8rUpHfF4/mqdefault.jpg","l":"en"},{"id":"TlhIa3UsE3Y","t":"Maghapuranam pravachanam on 5/2/2019 chapter 1","p":"2019-02-05","th":"https://i.ytimg.com/vi/TlhIa3UsE3Y/mqdefault.jpg","l":"en"},{"id":"krnmYvmuHgk","t":"Maghapuranam chapter 30","p":"2018-02-15","th":"https://i.ytimg.com/vi/krnmYvmuHgk/mqdefault.jpg","l":"en"},{"id":"wrSg60Oj4ko","t":"Maghapuranam chapter 29","p":"2018-02-14","th":"https://i.ytimg.com/vi/wrSg60Oj4ko/mqdefault.jpg","l":"en"},{"id":"AumImbRgU4M","t":"Maghapuranam chapter 28","p":"2018-02-13","th":"https://i.ytimg.com/vi/AumImbRgU4M/mqdefault.jpg","l":"en"},{"id":"KclnRlIw6tc","t":"Maghapuranam chapter 27","p":"2018-02-12","th":"https://i.ytimg.com/vi/KclnRlIw6tc/mqdefault.jpg","l":"en"},{"id":"JPoIAg6eC88","t":"Maghapuranam chapter 26","p":"2018-02-11","th":"https://i.ytimg.com/vi/JPoIAg6eC88/mqdefault.jpg","l":"en"},{"id":"x1dnJVa_m2o","t":"Maghapuranam chapter 10","p":"2018-01-26","th":"https://i.ytimg.com/vi/x1dnJVa_m2o/mqdefault.jpg","l":"en"},{"id":"FPenK4Gb9zU","t":"Maghapuranam chapter 9","p":"2018-01-25","th":"https://i.ytimg.com/vi/FPenK4Gb9zU/mqdefault.jpg","l":"en"},{"id":"bXQIGPh4y6Y","t":"Maghapuranam chapter 8","p":"2018-01-24","th":"https://i.ytimg.com/vi/bXQIGPh4y6Y/mqdefault.jpg","l":"en"},{"id":"nFjBGwp2Sg4","t":"Maghapuranam chapter 7","p":"2018-01-23","th":"https://i.ytimg.com/vi/nFjBGwp2Sg4/mqdefault.jpg","l":"en"},{"id":"YsCM_d3XTk0","t":"Maghapuranam chapter 6","p":"2018-01-22","th":"https://i.ytimg.com/vi/YsCM_d3XTk0/mqdefault.jpg","l":"en"},{"id":"aTfpd51eBpE","t":"Maghapuranam chapter 5","p":"2018-01-21","th":"https://i.ytimg.com/vi/aTfpd51eBpE/mqdefault.jpg","l":"en"},{"id":"jOdHNR9KP7c","t":"Maghapuranam chapter 4","p":"2018-01-20","th":"https://i.ytimg.com/vi/jOdHNR9KP7c/mqdefault.jpg","l":"en"},{"id":"hraUDA9X6ko","t":"Maghapuranam chapter 3","p":"2018-01-19","th":"https://i.ytimg.com/vi/hraUDA9X6ko/mqdefault.jpg","l":"en"},{"id":"dPw_rVhraKM","t":"Maghapuranam chapter 2","p":"2018-01-18","th":"https://i.ytimg.com/vi/dPw_rVhraKM/mqdefault.jpg","l":"en"},{"id":"8Ctu6MXTQvY","t":"Maghapuranam chapter 1","p":"2018-01-17","th":"https://i.ytimg.com/vi/8Ctu6MXTQvY/mqdefault.jpg","l":"en"},{"id":"GuS1OQ3spE0","t":"Maghapuranam","p":"2017-02-26","th":"https://i.ytimg.com/vi/GuS1OQ3spE0/mqdefault.jpg","l":"en"},{"id":"-Q3ov5eGS7c","t":"Maghapuranam","p":"2017-02-25","th":"https://i.ytimg.com/vi/-Q3ov5eGS7c/mqdefault.jpg","l":"en"},{"id":"15g1w1Uba4c","t":"Maghapuranam","p":"2017-02-23","th":"https://i.ytimg.com/vi/15g1w1Uba4c/mqdefault.jpg","l":"en"},{"id":"VfTND07Sfxo","t":"Maghapuranam","p":"2017-02-22","th":"https://i.ytimg.com/vi/VfTND07Sfxo/mqdefault.jpg","l":"en"},{"id":"zX8V6IHDpKg","t":"Maghapuranam","p":"2017-02-21","th":"https://i.ytimg.com/vi/zX8V6IHDpKg/mqdefault.jpg","l":"en"},{"id":"BOQ8zkeEVyo","t":"Maghapuranam","p":"2017-02-20","th":"https://i.ytimg.com/vi/BOQ8zkeEVyo/mqdefault.jpg","l":"en"},{"id":"UfmoHLTGM1M","t":"Maghapuranam","p":"2017-02-19","th":"https://i.ytimg.com/vi/UfmoHLTGM1M/mqdefault.jpg","l":"en"},{"id":"KZS31Cyuuug","t":"Maghapuranam","p":"2017-02-18","th":"https://i.ytimg.com/vi/KZS31Cyuuug/mqdefault.jpg","l":"en"},{"id":"yYch5yP_TVc","t":"Maghapuranam","p":"2017-02-17","th":"https://i.ytimg.com/vi/yYch5yP_TVc/mqdefault.jpg","l":"en"},{"id":"sZjNnL-CFSA","t":"Maghapuranam","p":"2017-02-16","th":"https://i.ytimg.com/vi/sZjNnL-CFSA/mqdefault.jpg","l":"en"},{"id":"RxxpkJJaGOw","t":"Maghapuranam","p":"2017-02-15","th":"https://i.ytimg.com/vi/RxxpkJJaGOw/mqdefault.jpg","l":"en"},{"id":"rcBOsTlKY7s","t":"Maghapuranam","p":"2017-02-14","th":"https://i.ytimg.com/vi/rcBOsTlKY7s/mqdefault.jpg","l":"en"},{"id":"A30DACS7TAg","t":"Maghapuranam","p":"2017-02-13","th":"https://i.ytimg.com/vi/A30DACS7TAg/mqdefault.jpg","l":"en"},{"id":"v_u0JwYuc_M","t":"Maghapuranam","p":"2017-02-12","th":"https://i.ytimg.com/vi/v_u0JwYuc_M/mqdefault.jpg","l":"en"},{"id":"oa1A4EI6XPE","t":"Maghapuranam","p":"2017-02-11","th":"https://i.ytimg.com/vi/oa1A4EI6XPE/mqdefault.jpg","l":"en"},{"id":"YNwsSn_8RfQ","t":"Maghapuranam","p":"2017-02-10","th":"https://i.ytimg.com/vi/YNwsSn_8RfQ/mqdefault.jpg","l":"en"},{"id":"hZJBPdqBVbY","t":"Maghapuranam","p":"2017-02-09","th":"https://i.ytimg.com/vi/hZJBPdqBVbY/mqdefault.jpg","l":"en"},{"id":"UatgzIq0xKk","t":"Maghapuranam","p":"2017-02-08","th":"https://i.ytimg.com/vi/UatgzIq0xKk/mqdefault.jpg","l":"en"},{"id":"bbqLQPwFOvw","t":"Maghapuranam","p":"2017-02-07","th":"https://i.ytimg.com/vi/bbqLQPwFOvw/mqdefault.jpg","l":"en"},{"id":"mMRlTJN3MrE","t":"Maghapuranam","p":"2017-02-06","th":"https://i.ytimg.com/vi/mMRlTJN3MrE/mqdefault.jpg","l":"en"},{"id":"zl7gmxvI3FM","t":"Maghapuranam","p":"2017-02-05","th":"https://i.ytimg.com/vi/zl7gmxvI3FM/mqdefault.jpg","l":"en"},{"id":"b_0iXJxd6pI","t":"Maghapuranam","p":"2017-02-04","th":"https://i.ytimg.com/vi/b_0iXJxd6pI/mqdefault.jpg","l":"en"},{"id":"IVMMKaf8NAk","t":"Maghapuranam","p":"2017-02-03","th":"https://i.ytimg.com/vi/IVMMKaf8NAk/mqdefault.jpg","l":"en"},{"id":"SIN_uFKKmtA","t":"Maghapuranam","p":"2017-02-02","th":"https://i.ytimg.com/vi/SIN_uFKKmtA/mqdefault.jpg","l":"en"},{"id":"a0nVq_LNZdI","t":"Maghapuranam","p":"2017-02-01","th":"https://i.ytimg.com/vi/a0nVq_LNZdI/mqdefault.jpg","l":"en"},{"id":"YWHokghwmqw","t":"Maghapuranam","p":"2017-01-31","th":"https://i.ytimg.com/vi/YWHokghwmqw/mqdefault.jpg","l":"en"},{"id":"DTOzFkkRM4U","t":"Maghapuranam","p":"2017-01-30","th":"https://i.ytimg.com/vi/DTOzFkkRM4U/mqdefault.jpg","l":"en"},{"id":"QamYfOAsiv4","t":"Maghapuranam","p":"2017-01-29","th":"https://i.ytimg.com/vi/QamYfOAsiv4/mqdefault.jpg","l":"en"},{"id":"k0O-tmkDMPc","t":"Maghapuranam","p":"2017-01-28","th":"https://i.ytimg.com/vi/k0O-tmkDMPc/mqdefault.jpg","l":"en"}]}